{
  "entrant_id": "njusim-mace",
  "name": "NjuSim MACE Forecast",
  "type": "participant",
  "github": "Ustinian5",
  "method": "Frozen statistical expert ensemble with budgeted historical calibration and CRPS-based weighting. Scalar public-opinion and consumer forecasts; no LLM calls or paid data.",
  "keys": [
    {
      "id": "k1",
      "alg": "ed25519",
      "public": "eQVOg1MmD2yPSGRJDMHD/CtbA2kfN+zwKB72wPzHJcg="
    }
  ]
}